id,president,speech_type,sequence,paragraph_id,content,is_applause,word_count,char_count,sentence_count,reading_time_seconds
obama_sotu_02_081,Obama,SOTU,02,81,Our deficit will grow. Premiums will go up. Patients will be denied the care they need.,0,16,87,3,4.8
obama_sotu_02_082,Obama,SOTU,02,82,Small-business owners will continue to drop coverage altogether.,0,8,64,1,2.4
obama_sotu_02_083,Obama,SOTU,02,83,"I will not walk away from these Americans, and neither should the people in this Chamber. So as temperatures cool, I want everyone to take another look at the plan we've proposed. There's a reason why many doctors, nurses, and health care experts who know our system best consider this approach a vast improvement over the status quo.",0,58,334,3,17.4
obama_sotu_02_084,Obama,SOTU,02,84,"But if anyone from either party has a better approach that will bring down premiums, bring down the deficit, cover the uninsured, strengthen Medicare for seniors, and stop insurance company abuses, let me know.",0,34,210,1,10.2
obama_sotu_02_085,Obama,SOTU,02,85,"Let me know. I'm eager to see it. Here's what I ask Congress, though: Don't walk away from reform.",0,19,98,3,5.7
obama_sotu_02_086,Obama,SOTU,02,86,Not now. Not when we are so close. Let us find a way to come together and finish the job for the American people.,0,24,113,3,7.2
obama_sotu_02_087,Obama,SOTU,02,87,"Let's get it done. Let's get it done. Now, even as health care reform would reduce our deficit, it's not enough to dig us out of a massive fiscal hole in which we find ourselves.",0,35,178,3,10.5
obama_sotu_02_088,Obama,SOTU,02,88,"It's a challenge that makes all others that much harder to solve and one that's been subject to a lot of political posturing. So let me start the discussion of Government spending by setting the record straight. At the beginning of the last decade, the year 2000, America had a budget surplus of over $200 billion.",0,56,314,3,16.8
obama_sotu_02_089,Obama,SOTU,02,89,"By the time I took office, we had a 1-year deficit of over $1 trillion and projected deficits of $8 trillion over the next decade. Most of this was the result of not paying for two wars, two tax cuts, and an expensive prescription drug program. On top of that, the effects of the recession put a $3 trillion hole in our budget.",0,63,327,3,18.9
obama_sotu_02_090,Obama,SOTU,02,90,"All this was before I walked in the door. [Laughter] Now--[applause ]--just stating the facts. Now, if we had taken office in ordinary times, I would have liked nothing more than to start bringing down the deficit.",0,37,214,3,11.1
obama_sotu_02_091,Obama,SOTU,02,91,But we took office amid a crisis. And our efforts to prevent a second depression have added another $1 trillion to our national debt. That too is a fact.,0,29,153,3,8.7
obama_sotu_02_092,Obama,SOTU,02,92,I'm absolutely convinced that was the right thing to do.,0,10,56,1,3.0
obama_sotu_02_093,Obama,SOTU,02,93,But families across the country are tightening their belts and making tough decisions. The Federal Government should do the same. So tonight I'm proposing specific steps to pay for the trillion dollars that it took to rescue the economy last year.,0,41,247,3,12.3
obama_sotu_02_094,Obama,SOTU,02,94,"Starting in 2011, we are prepared to freeze Government spending for 3 years. Spending related to our national security, Medicare, Medicaid, and Social Security will not be affected.",0,28,181,2,8.4
obama_sotu_02_095,Obama,SOTU,02,95,"But all other discretionary Government programs will. Like any cash-strapped family, we will work within a budget to invest in what we need and sacrifice what we don't. And if I have to enforce this discipline by veto, I will.",0,40,226,3,12.0
obama_sotu_02_096,Obama,SOTU,02,96,"We will continue to go through the budget, line by line, page by page, to eliminate programs that we can't afford and don't work. We've already identified $20 billion in savings for next year.",0,34,192,2,10.2
obama_sotu_02_097,Obama,SOTU,02,97,"To help working families, we'll extend our middle class tax cuts.",0,11,65,1,3.3
obama_sotu_02_098,Obama,SOTU,02,98,"But at a time of record deficits, we will not continue tax cuts for oil companies, for investment fund managers, and for those making over $250,000 a year. We just can't afford it. Now, even after paying for what we spent on my watch, we'll still face the massive deficit we had when I took office.",0,56,298,3,16.8
obama_sotu_02_099,Obama,SOTU,02,99,"More importantly, the cost of Medicare, Medicaid, and Social Security will continue to skyrocket. That's why I've called for a bipartisan fiscal commission, modeled on a proposal by Republican Judd Gregg and Democrat Kent Conrad. This can't be one of those Washington gimmicks that lets us pretend we solve a problem.",0,51,317,3,15.3
obama_sotu_02_100,Obama,SOTU,02,100,"The commission will have to provide a specific set of solutions by a certain deadline. Now, yesterday the Senate blocked a bill that would have created this commission, so I'll issue an Executive order that will allow us to go forward, because I refuse to pass this problem on to another generation of Americans. And when the vote comes tomorrow, the Senate should restore the pay-as-you-go law that was a big reason for why we had record surpluses in the 1990s.",0,81,462,3,24.3
obama_sotu_02_101,Obama,SOTU,02,101,"Now, I know that some in my own party will argue that we can't address the deficit or freeze Government spending when so many are still hurting. And I agree, which is why this freeze won't take effect until next year, when the economy is stronger. That's how budgeting works.",0,50,275,3,15.0
obama_sotu_02_102,Obama,SOTU,02,102,"[Laughter] But understand, if we don't take meaningful steps to rein in our debt, it could damage our markets, increase the cost of borrowing, and jeopardize our recovery, all of which would have an even worse effect on our job growth and family incomes. From some on the right, I expect we'll hear a different argument, that if we just make fewer investments in our people, extend tax cuts, including those for the wealthier Americans, eliminate more regulations, maintain the status quo on health care, our deficits will go away. The problem is, that's what we did for 8 years.",0,100,579,3,30.0
obama_sotu_02_103,Obama,SOTU,02,103,That's what helped us into this crisis. It's what helped lead to these deficits. We can't do it again.,0,19,102,3,5.7
obama_sotu_02_104,Obama,SOTU,02,104,"Rather than fight the same tired battles that have dominated Washington for decades, it's time to try something new. Let's invest in our people without leaving them a mountain of debt. Let's meet our responsibility to the citizens who sent us here.",0,42,248,3,12.6
obama_sotu_02_105,Obama,SOTU,02,105,"Let's try common sense--[Laughter]--a novel concept. Now, to do that, we have to recognize that we face more than a deficit of dollars right now. We face a deficit of trust, deep and corrosive doubts about how Washington works that have been growing for years.",0,45,260,3,13.5
obama_sotu_02_106,Obama,SOTU,02,106,"To close that credibility gap, we have to take action on both ends of Pennsylvania Avenue to end the outsized influence of lobbyists, to do our work openly, to give our people the Government they deserve. Now, that's what I came to Washington to do. That's why, for the first time in history, my administration posts on--our White House visitors online.",0,61,353,3,18.3
obama_sotu_02_107,Obama,SOTU,02,107,That's why we've excluded lobbyists from policymaking jobs or seats on Federal boards and commissions.,0,15,102,1,4.5
obama_sotu_02_108,Obama,SOTU,02,108,"But we can't stop there. It's time to require lobbyists to disclose each contact they make on behalf of a client, with my administration or with Congress. It's time to put strict limits on the contributions that lobbyists give to candidates for Federal office.",0,44,260,3,13.2
obama_sotu_02_109,Obama,SOTU,02,109,"With all due deference to separation of powers, last week, the Supreme Court reversed a century of law that I believe will open the floodgates for special interests, including foreign corporations, to spend without limit in our elections. I don't think American elections should be bankrolled by America's most powerful interests, or worse, by foreign entities. They should be decided by the American people.",0,64,408,3,19.2
obama_sotu_02_110,Obama,SOTU,02,110,"And I'd urge Democrats and Republicans to pass a bill that helps correct some of these problems. I'm also calling on Congress to continue down the path of earmark reform, Democrats and Republicans--Democrats and Republicans. Look, you've trimmed some of this spending, you've embraced some meaningful change, but restoring the public trust demands more.",0,54,353,3,16.2
obama_sotu_02_111,Obama,SOTU,02,111,"For example, some Members of Congress post some earmark requests online.",0,11,72,1,3.3
obama_sotu_02_112,Obama,SOTU,02,112,"Tonight I'm calling on Congress to publish all earmark requests on a single web site before there's a vote so that the American people can see how their money is being spent. Of course, none of these reforms will even happen if we don't also reform how we work with one another. Now, I'm not naive.",0,56,298,3,16.8
obama_sotu_02_113,Obama,SOTU,02,113,"I never thought that the mere fact of my election would usher in peace and harmony and-- [Laughter]--some postpartisan era. I knew that both parties have fed divisions that are deeply entrenched. And on some issues, there are simply philosophical differences that will always cause us to part ways.",0,49,298,3,14.7
obama_sotu_02_114,Obama,SOTU,02,114,"These disagreements, about the role of government in our lives, about our national priorities and our national security, they've been taking place for over 200 years. They're the very essence of our democracy.",0,33,209,2,9.9
obama_sotu_02_115,Obama,SOTU,02,115,"But what frustrates the American people is a Washington where every day is election day. We can't wage a perpetual campaign where the only goal is to see who can get the most embarrassing headlines about the other side, a belief that if you lose, I win. Neither party should delay or obstruct every single bill just because they can.",0,60,333,3,18.0
obama_sotu_02_116,Obama,SOTU,02,116,"The confirmation of--I'm speaking to both parties now--the confirmation of well-qualified public servants shouldn't be held hostage to the pet projects or grudges of a few individual Senators. Washington may think that saying anything about the other side, no matter how false, no matter how malicious, is just part of the game.",0,52,328,2,15.6
obama_sotu_02_117,Obama,SOTU,02,117,"But it's precisely such politics that has stopped either party from helping the American people. Worse yet, it's sowing further division among our citizens, further distrust in our Government. So no, I will not give up on trying to change the tone of our politics.",0,45,264,3,13.5
obama_sotu_02_118,Obama,SOTU,02,118,"I know it's an election year. And after last week, it's clear that campaign fever has come even earlier than usual.",0,21,115,2,6.3
obama_sotu_02_119,Obama,SOTU,02,119,But we still need to govern.,0,6,28,1,1.8
obama_sotu_02_120,Obama,SOTU,02,120,"To Democrats, I would remind you that we still have the largest majority in decades and the people expect us to solve problems, not run for the hills. And if the Republican leadership is going to insist that 60 votes in the Senate are required to do any business at all in this town--a supermajority-- then the responsibility to govern is now yours as well. Just saying no to everything may be good short-term politics, but it's not leadership.",0,79,444,3,23.7
obama_sotu_02_121,Obama,SOTU,02,121,"We were sent here to serve our citizens, not our ambitions. So let's show the American people that we can do it together. This week, I'll be addressing a meeting of the House Republicans.",0,34,187,3,10.2
obama_sotu_02_122,Obama,SOTU,02,122,"I'd like to begin monthly meetings with both Democratic and Republican leadership. I know you can't wait. [Laughter] Now, throughout our history, no issue has united this country more than our security.",0,32,202,3,9.6
obama_sotu_02_123,Obama,SOTU,02,123,"Sadly, some of the unity we felt after 9/11 has dissipated. And we can argue all we want about who's to blame for this, but I'm not interested in relitigating the past. I know that all of us love this country.",0,41,209,3,12.3
obama_sotu_02_124,Obama,SOTU,02,124,All of us are committed to its defense. So let's put aside the schoolyard taunts about who's tough. Let's reject the false choice between protecting our people and upholding our values.,0,31,185,3,9.3
obama_sotu_02_125,Obama,SOTU,02,125,Let's leave behind the fear and division and do what it takes to defend our Nation and forge a more hopeful future for America and for the world. That's the work we began last year.,0,35,181,2,10.5
obama_sotu_02_126,Obama,SOTU,02,126,"Since the day I took office, we've renewed our focus on the terrorists who threaten our Nation. We've made substantial investments in our homeland security and disrupted plots that threatened to take American lives.",0,34,215,2,10.2
obama_sotu_02_127,Obama,SOTU,02,127,"We are filling unacceptable gaps revealed by the failed Christmas attack, with better airline security and swifter action on our intelligence. We've prohibited torture and strengthened partnerships from the Pacific to South Asia to the Arabian Peninsula. And in the last year, hundreds of Al Qaida's fighters and affiliates, including many senior leaders, have been captured or killed, far more than in 2008.",0,63,408,3,18.9
obama_sotu_02_128,Obama,SOTU,02,128,"And in Afghanistan, we're increasing our troops and training Afghan security forces so they can begin to take the lead in July of 2011 and our troops can begin to come home.",0,32,173,1,9.6
obama_sotu_02_129,Obama,SOTU,02,129,"We will reward good governance, work to reduce corruption, and support the rights of all Afghans, men and women alike. We're joined by allies and partners who have increased their own commitments and who will come together tomorrow in London to reaffirm our common purpose. There will be difficult days ahead, but I am absolutely confident we will succeed.",0,59,356,3,17.7
obama_sotu_02_130,Obama,SOTU,02,130,"As we take the fight to Al Qaida, we are responsibly leaving Iraq to its people. As a candidate, I promised that I would end this war, and that is what I am doing as President.",0,36,176,2,10.8
obama_sotu_02_131,Obama,SOTU,02,131,We will have all of our combat troops out of Iraq by the end of this August.,0,17,76,1,5.1
obama_sotu_02_132,Obama,SOTU,02,132,"We will support the Iraqi Government as they hold elections, and we will continue to partner with the Iraqi people to promote regional peace and prosperity.",0,26,156,1,7.8
obama_sotu_02_133,Obama,SOTU,02,133,"But make no mistake: This war is ending, and all of our troops are coming home.",0,16,79,1,4.8
obama_sotu_02_134,Obama,SOTU,02,134,"Tonight all of our men and women in uniform, in Iraq, in Afghanistan, and around the world, they have to know that we--that they have our respect, our gratitude, our full support. And just as they must have the resources they need in war, we all have a responsibility to support them when they come home. That's why we made the largest increase in investments for veterans in decades last year.",0,71,394,3,21.3
obama_sotu_02_135,Obama,SOTU,02,135,"That's why we're building a 21st-century VA. And that's why Michelle has joined with Jill Biden to forge a national commitment to support military families. Now, even as we prosecute two wars, we're also confronting perhaps the greatest danger to the American people, the threat of nuclear weapons.",0,48,298,3,14.4
obama_sotu_02_136,Obama,SOTU,02,136,I've embraced the vision of John F. Kennedy and Ronald Reagan through a strategy that reverses the spread of these weapons and seeks a world without them.,0,27,154,2,8.1
obama_sotu_02_137,Obama,SOTU,02,137,"To reduce our stockpiles and launchers, while ensuring our deterrent, the United States and Russia are completing negotiations on the farthest reaching arms control treaty in nearly two decades. And at April's Nuclear Security Summit, we will bring 44 nations together here in Washington, DC, behind a clear goal: securing all vulnerable nuclear materials around the world in 4 years so that they never fall into the hands of terrorists. Now, these diplomatic efforts have also strengthened our hand in dealing with those nations that insist on violating international agreements in pursuit of nuclear weapons.",0,95,610,3,28.5
obama_sotu_02_138,Obama,SOTU,02,138,"That's why North Korea now faces increased isolation and stronger sanctions, sanctions that are being vigorously enforced. That's why the international community is more united and the Islamic Republic of Iran is more isolated. And as Iran's leaders continue to ignore their obligations, there should be no doubt: They too will face growing consequences.",0,54,354,3,16.2
obama_sotu_02_139,Obama,SOTU,02,139,That is a promise. That's the leadership we are providing: engagement that advances the common security and prosperity of all people. We're working through the G-20 to sustain a lasting global recovery.,0,32,202,3,9.6
obama_sotu_02_140,Obama,SOTU,02,140,We're working with Muslim communities around the world to promote science and education and innovation.,0,15,103,1,4.5
obama_sotu_02_141,Obama,SOTU,02,141,"We have gone from a bystander to a leader in the fight against climate change. We're helping developing countries to feed themselves and continuing the fight against HIV/AIDS. And we are launching a new initiative that will give us the capacity to respond faster and more effectively to bioterrorism or an infectious disease, a plan that will counter threats at home and strengthen public health abroad.",0,66,403,3,19.8
obama_sotu_02_142,Obama,SOTU,02,142,"As we have for over 60 years, America takes these actions because our destiny is connected to those beyond our shores.",0,21,118,1,6.3
obama_sotu_02_143,Obama,SOTU,02,143,"But we also do it because it is right. That's why, as we meet here tonight, over 10,000 Americans are working with many nations to help the people of Haiti recover and rebuild. That's why we stand with the girl who yearns to go to school in Afghanistan, why we support the human rights of the women marching through the streets of Iran, why we advocate for the young man denied a job by corruption in Guinea.",0,77,408,3,23.1
obama_sotu_02_144,Obama,SOTU,02,144,"For America must always stand on the side of freedom and human dignity--always. Abroad, America's greatest source of strength has always been our ideals. The same is true at home.",0,30,179,3,9.0
obama_sotu_02_145,Obama,SOTU,02,145,"We find unity in our incredible diversity, drawing on the promise enshrined in our Constitution: The notion that we're all created equal; that no matter who you are or what you look like, if you abide by the law, you should be protected by it; if you adhere to our common values, you should be treated no different than anyone else.",0,61,332,1,18.3
obama_sotu_02_146,Obama,SOTU,02,146,We must continually renew this promise.,0,6,39,1,1.8
obama_sotu_02_147,Obama,SOTU,02,147,"My administration has a Division that is once again prosecuting violations and employment discrimination. We finally strengthened our laws to protect against crimes driven by hate. This year, I will work with Congress and our military to finally repeal the law that denies gay Americans the right to serve the country they love because of who they are.",0,58,352,3,17.4
obama_sotu_02_148,Obama,SOTU,02,148,"It's the right thing to do. We're going to crack down on violations of equal pay laws so that women get equal pay for an equal day's work. And we should continue the work of fixing our broken immigration system, to secure our borders and enforce our laws and ensure that everyone who plays by the rules can contribute to our economy and enrich our Nation.",0,66,355,3,19.8
obama_sotu_02_149,Obama,SOTU,02,149,"In the end, it's our ideals, our values that built America, values that allowed us to forge a nation made up of immigrants from every corner of the globe, values that drive our citizens still. Every day, Americans meet their responsibilities to their families and their employers. Time and again, they lend a hand to their neighbors and give back to their country.",0,63,364,3,18.9
obama_sotu_02_150,Obama,SOTU,02,150,"They take pride in their labor and are generous in spirit. These aren't Republican values or Democratic values that they're living by, business values or labor values, they're American values. Unfortunately, too many of our citizens have lost faith that our biggest institutions--our corporations, our media, and, yes, our Government--still reflect these same values.",0,54,367,3,16.2
obama_sotu_02_151,Obama,SOTU,02,151,Each of these institutions are full of honorable men and women doing important work that helps our country prosper.,0,19,115,1,5.7
obama_sotu_02_152,Obama,SOTU,02,152,"But each time a CEO rewards himself for failure or a banker puts the rest of us at risk for his own selfish gain, people's doubts grow. Each time lobbyists game the system or politicians tear each other down instead of lifting this country up, we lose faith. The more that TV pundits reduce serious debates to silly arguments, big issues into sound bites, our citizens turn away.",0,68,379,3,20.4
obama_sotu_02_153,Obama,SOTU,02,153,No wonder there's so much cynicism out there. No wonder there's so much disappointment. I campaigned on the promise of change.,0,21,126,3,6.3
obama_sotu_02_154,Obama,SOTU,02,154,"Change we can believe in, the slogan went. And right now I know there are many Americans who aren't sure if they still believe we can change or that I can deliver it.",0,33,166,2,9.9
obama_sotu_02_155,Obama,SOTU,02,155,"But remember this: I never suggested that change would be easy or that I could do it alone. Democracy in a nation of 300 million people can be noisy and messy and complicated. And when you try to do big things and make big changes, it stirs passions and controversy.",0,50,266,3,15.0
obama_sotu_02_156,Obama,SOTU,02,156,"That's just how it is. Those of us in public office can respond to this reality by playing it safe and avoid telling hard truths and pointing fingers. We can do what's necessary to keep our poll numbers high and get through the next election, instead of doing what's best for the next generation.",0,54,296,3,16.2
obama_sotu_02_157,Obama,SOTU,02,157,"But I also know this: If people had made that decision 50 years ago or 100 years ago or 200 years ago, we wouldn't be here tonight. The only reason we are here is because generations of Americans were unafraid to do what was hard, to do what was needed even when success was uncertain, to do what it took to keep the dream of this Nation alive for their children and their grandchildren. Now, our administration has had some political setbacks this year, and some of them were deserved.",0,90,486,3,27.0
obama_sotu_02_158,Obama,SOTU,02,158,"But I wake up every day knowing that they are nothing compared to the setbacks that families all across this country have faced this year. And what keeps me going, what keeps me fighting, is that despite all these setbacks, that spirit of determination and optimism, that fundamental decency that has always been at the core of the American people, that lives on. It lives on in the struggling small-business owner who wrote to me of his company, ""None of us,"" he said, "".",0,84,472,3,25.2
obama_sotu_02_159,Obama,SOTU,02,159,". . are willing to consider, even slightly, that we might fail."" It lives on in the woman who said that even though she and her neighbors have felt the pain of recession, ""We are strong.",0,36,186,4,10.8
obama_sotu_02_160,Obama,SOTU,02,160,"We are American."" It lives on in the 8-year-old boy in Louisiana who just sent me his allowance and asked if I would give it to the people of Haiti. And it lives on in all the Americans who've dropped everything to go someplace they've never been and pull people they've never known from the rubble, prompting chants of ""U.S.A.! U.S.A.!",0,61,336,8,18.3
obama_sotu_02_161,Obama,SOTU,02,161,"U.S.A.!"" when another life was saved. The spirit that has sustained this Nation for more than two centuries lives on in you, its people.",0,24,136,5,7.2
obama_sotu_02_162,Obama,SOTU,02,162,We have finished a difficult year.,0,6,34,1,1.8
obama_sotu_02_163,Obama,SOTU,02,163,We have come through a difficult decade.,0,7,40,1,2.1
obama_sotu_02_164,Obama,SOTU,02,164,But a new year has come. A new decade stretches before us. We don't quit.,0,15,73,3,4.5
obama_sotu_02_165,Obama,SOTU,02,165,"I don't quit. Let's seize this moment to start anew, to carry the dream forward, and to strengthen our Union once more. Thank you.",0,24,130,3,7.2
obama_sotu_02_166,Obama,SOTU,02,166,"God bless you, and God bless the United States of America.",0,11,58,1,3.3
