id,president,speech_type,sequence,paragraph_id,content,is_applause,word_count,char_count,sentence_count,reading_time_seconds
biden_sotu_01_001,Biden,SOTU,01,1,"JOSEPH R. BIDEN, JR. Address to a Joint Session of Congress March 1, 2022 Thank you.",0,16,84,3,4.8
biden_sotu_01_002,Biden,SOTU,01,2,Thank you. Thank you. Good to be back.,0,8,38,3,2.4
biden_sotu_01_003,Biden,SOTU,01,3,"As Mitch and Chuck will understand, it's good to be almost home, down the hall. [Laughter] Anyway, thank you all. Madam Speaker, Madam Vice President—no President has ever said those words from this podium.",0,34,206,3,10.2
biden_sotu_01_004,Biden,SOTU,01,4,"No President has ever said those words, and it's about time. First Lady—I'm her husband; Second Gentleman; Chief Justice; Members of the United States Congress and the Cabinet; distinguished guests; my fellow Americans: While the setting tonight is familiar, this gathering is just a little bit different, a reminder of the extraordinary times we're in. Throughout our history, Presidents have come to this Chamber to speak to Congress, to the Nation, and to the world; to declare war, to celebrate peace; to announce new plans and possibilities.",0,87,546,3,26.1
biden_sotu_01_005,Biden,SOTU,01,5,"Tonight I come to talk about crisis and opportunity, about rebuilding the Nation, revitalizing our democracy, and winning the future for America. I stand here tonight, 1 day shy of the hundredth day of my administration, hundred days since I took the oath of office and lifted my hand off our family Bible and inherited a Nation—we all did—that was in crisis: the worst pandemic in a century, the worst economic crisis since the Great Depression, the worst attack on our democracy since the Civil War. Now, after just 100 days, I can report to the Nation: America is on the move again, turning peril into possibility, crisis to opportunity, setbacks into strength.",0,113,664,3,33.9
biden_sotu_01_006,Biden,SOTU,01,6,"We all know life can knock us down. But, in America, we never, ever, ever stay down. Americans always get up.",0,21,109,3,6.3
biden_sotu_01_007,Biden,SOTU,01,7,"Today, that's what we're doing: America is rising anew, choosing hope over fear, truth over lies, and light over darkness.",0,20,122,1,6.0
biden_sotu_01_008,Biden,SOTU,01,8,"After 100 days of rescue and renewal, America is ready for takeoff, in my view. We're working again, dreaming again, discovering again, and leading the world again.",0,27,164,2,8.1
biden_sotu_01_009,Biden,SOTU,01,9,"We have shown each other and the world that there's no quit in America—none. One hundred days ago, America's house was on fire. And we had to act.",0,28,146,3,8.4
biden_sotu_01_010,Biden,SOTU,01,10,"And thanks to the extraordinary leadership of Speaker Pelosi; Majority Leader Schumer; and the overwhelming support of the American people— Democrats, Independents, and Republicans—we did act. Together we passed the American Rescue Plan, one of the most consequential rescue packages in American history. We're already seeing the results.",0,48,338,3,14.4
biden_sotu_01_011,Biden,SOTU,01,11,[Applause ] We're already seeing the results.,0,7,45,1,2.1
biden_sotu_01_012,Biden,SOTU,01,12,"After I promised we'd get 100 million COVID-19 vaccine shots into people's arms in 100 days, we will have provided over 220 million COVID shots in those 100 days. Thanks to all the help of all of you, we're marshaling—with your help, everyone's help—we're marshaling every Federal resource. We've gotten vaccines to nearly 40,000 pharmacies and over 700 community health centers where the poorest of the poor can be reached.",0,70,424,3,21.0
biden_sotu_01_013,Biden,SOTU,01,13,"We're setting up community vaccination sites, developing mobile units to get to hard-to-reach communities. Today, 90 percent of Americans now live within 5 miles of a vaccination site. Everyone over the age of 16—everyone—is now eligible to get vaccinated right now, right away.",0,43,278,3,12.9
biden_sotu_01_014,Biden,SOTU,01,14,"Go get vaccinated, America. Go and get the vaccination. They're available.",0,11,74,3,3.3
biden_sotu_01_015,Biden,SOTU,01,15,"When I was sworn in on January 20, less than 1 percent of the seniors in America were fully vaccinated against COVID-19. One hundred days later, 70 percent of seniors in America over 65 are protected—fully protected. Senior deaths from COVID-19 are down 80 percent since January—down 80 percent—because of all of you.",0,53,317,3,15.9
biden_sotu_01_016,Biden,SOTU,01,16,"And more than half of all the adults in America have gotten at least one shot. At a mass vaccination center in Glendale, Arizona, I asked the nurse—I said, ""What's it like?"" She looked at me, and she said, ""It's like every shot is giving a dose of hope""—was her phrase. ""A dose of hope."" A dose of hope for an educator in Florida who has a child suffering from an autoimmune disease—wrote to me, said she's worried—that she was worrying about bringing the virus home.",0,86,467,5,25.8
biden_sotu_01_017,Biden,SOTU,01,17,"She said she then got vaccinated at a large site, in her car. She said she sat in her car, when she got vaccinated and just cried, cried out of joy and cried out of relief. Parents seeing the smiles on their kids' faces, for those who are able to go back to school because the teachers and school bus drivers and cafeteria workers have been vaccinated.",0,67,352,3,20.1
biden_sotu_01_018,Biden,SOTU,01,18,Grandparents hugging their children and grandchildren instead of pressing hands against a window to say goodbye. It means everything. Those things mean everything.,0,23,163,3,6.9
biden_sotu_01_019,Biden,SOTU,01,19,"You know, there's still—you all know it; you know it better than any group of Americans—there's still more work to do to beat this virus. We can't let our guard down.",0,31,166,2,9.3
biden_sotu_01_020,Biden,SOTU,01,20,"But tonight I can say it: Because of you, the American people, our progress these past hundred days against one of the worst pandemics in history has been one of the greatest logistical achievements—logistical achievements— this country has ever seen. What else have we done in those first hundred days? We kept our commitment—Democrats and Republicans—of sending $1,400 rescue checks to 85 percent of American households.",0,66,422,3,19.8
biden_sotu_01_021,Biden,SOTU,01,21,We've already sent more than 160 million checks out the door. It's making the difference. You all know it when you go home.,0,23,123,3,6.9
biden_sotu_01_022,Biden,SOTU,01,22,"For many people, it's making all the difference in the world. The single mom in Texas who wrote to me, she said she couldn't work, but she said the relief check put food on the table and saved her and her son from eviction from their apartment. A grandmother in Virginia who told me she immediately took her granddaughter to the eye doctor, something she said she put off for months because she didn't have the money.",0,77,417,3,23.1
biden_sotu_01_023,Biden,SOTU,01,23,"One of the defining images, at least from my perspective, in this crisis has been cars lined up, cars lined up for miles. And not people who just barely ever start those cars, nice cars lined up for miles, waiting for a box of food to be put in their trunk. I don't know about you, but I didn't ever think I'd see that in America.",0,66,330,3,19.8
biden_sotu_01_024,Biden,SOTU,01,24,"And all of this is through no fault of their own. No fault of their own, these people are in this position. That's why the Rescue Plan is delivering food and nutrition assistance to millions of Americans facing hunger, and hunger is down sharply already.",0,45,254,3,13.5
biden_sotu_01_025,Biden,SOTU,01,25,"We're also providing rental assistance—you all know this, but the American people, I want to make sure they understand—keeping people from being evicted from their homes, providing loans to small businesses to reopen and keep their employees on the job. During these 100 days, an additional 800,000 Americans enrolled in the Affordable Care Act when I established the special signup period to do that —800,000 in that period. We're making one of the largest one-time ever investments—ever—in improving health care for veterans.",0,82,527,3,24.6
biden_sotu_01_026,Biden,SOTU,01,26,"Critical investments to address the opioid crisis. And, maybe most importantly, thanks to the American Rescue Plan, we're on track to cut child poverty in America in half this year. And, in the process, while this was all going on, the economy created more than 1,300,000 new jobs in 100 days, more jobs in the first 100 days than any President on record.",0,63,355,3,18.9
biden_sotu_01_027,Biden,SOTU,01,27,The International Monetary Fund is now estimating our economy will grow at a rate of more than 6 percent this year. That will be the fastest pace of economic growth in this country in nearly four decades.,0,37,204,2,11.1
biden_sotu_01_028,Biden,SOTU,01,28,America is moving—moving forward—but we can't stop now. We're in competition with China and other countries to win the 21st century. We're at a great inflection point in history.,0,29,178,3,8.7
biden_sotu_01_029,Biden,SOTU,01,29,"We have to do more than just build back better—I mean, ""build back."" We have to build back better.",0,19,98,2,5.7
biden_sotu_01_030,Biden,SOTU,01,30,"We have to compete more strenuously than we have. Throughout our history, if you think about it, public investment in infrastructure has literally transformed America: our attitudes, as well as our opportunities. The transcontinental railroad, the interstate highways united two oceans and brought a totally new age of progress to the United States of America.",0,55,360,3,16.5
biden_sotu_01_031,Biden,SOTU,01,31,"Universal public schools and college aid opened wide the doors of opportunity. Scientific breakthroughs took us to the Moon—now we're on Mars—discovering vaccines, gave us the internet, and so much more. These are the investments we made together as one country, and investments that only the Government was in a position to make.",0,53,330,3,15.9
biden_sotu_01_032,Biden,SOTU,01,32,"Time and again, they propel us into the future. That's why I proposed the American Jobs Plan, a once-in-a-generation investment in America itself. This is the largest jobs plan since World War II.",0,33,196,3,9.9
biden_sotu_01_033,Biden,SOTU,01,33,"It creates jobs to upgrade our transportation infrastructure; jobs modernizing our roads, bridges, highways; jobs building ports and airports, rail corridors, transit lines. It's clean water. And, today, up to 10 million homes in America and more than 400,000 schools and childcare centers have pipes with lead in them, including in drinking water, a clear and present danger to our children's health.",0,62,401,3,18.6
biden_sotu_01_034,Biden,SOTU,01,34,"The American Jobs Plan creates jobs replacing 100 percent of the Nation's lead pipes and service lines so every American can drink clean water. And, in the process, it will create thousands and thousands of good-paying jobs. It creates jobs connecting every American with high-speed internet, including 35 percent of the rural America that still doesn't have it.",0,58,362,3,17.4
biden_sotu_01_035,Biden,SOTU,01,35,"This is going to help our kids and our businesses succeed in the 21st-century economy. And I'm asking the Vice President to lead this effort, if she would—— Vice President Kamala D. Harris .",0,34,190,3,10.2
biden_sotu_01_036,Biden,SOTU,01,36,Of course. The President. ——because I know it will get done.,0,11,60,3,3.3
biden_sotu_01_037,Biden,SOTU,01,37,"It creates jobs, building a modern power grid. Our grids are vulnerable to storms, hacks, catastrophic failures, with tragic results, as we saw in Texas and elsewhere during the winter storms. The American Jobs Plan will create jobs that will lay thousands of miles of transmission lines needed to build a resilient and fully clean grid.",0,56,337,3,16.8
biden_sotu_01_038,Biden,SOTU,01,38,"We can do that. Look, the American Jobs Plan will help millions of people get back to their jobs and back to their careers. Two million women have dropped out of the workforce during this pandemic—2 million, and too often because they couldn't get the care they needed to care for their child or care for an elderly parent who needs help.",0,62,338,3,18.6
biden_sotu_01_039,Biden,SOTU,01,39,"Eight hundred thousand families are on a Medicare waiting list right now to get homecare for their aging parent or loved one with a disability. If you think it's not important, check out in your own district, Democrat or Republican. Democrat or Republican voters, their great concern—almost as much as their children—is taking care of an elderly loved one who can't be left alone.",0,64,380,3,19.2
biden_sotu_01_040,Biden,SOTU,01,40,"Medicaid contemplated it, but this plan is going to help those families and create jobs for our caregivers with better wages and better benefits, continuing a cycle of growth.",0,29,175,1,8.7
biden_sotu_01_041,Biden,SOTU,01,41,"For too long, we've failed to use the most important word when it comes to meeting the climate crisis: ""jobs."" Jobs. Jobs.",0,22,122,3,6.6
biden_sotu_01_042,Biden,SOTU,01,42,"For me, when I think ""climate change,"" I think ""jobs."" The American Jobs Plan will put engineers and construction workers to work building more energy-efficient buildings and homes; electrical workers— IBEW members—installing 500,000 charging stations along our highways so we can own the electric car market. Farmers—farmers planting cover crops so they can reduce the carbon dioxide in the air and get paid for doing it. Look, but think about it: There is simply no reason why the blades for wind turbines can't be built in Pittsburgh instead of Beijing.",0,90,556,4,27.0
biden_sotu_01_043,Biden,SOTU,01,43,No reason. None. No reason.,0,5,27,3,1.5
biden_sotu_01_044,Biden,SOTU,01,44,"So, folks, there's no reason why American workers can't lead the world in the production of electric vehicles and batteries. I mean, there is no reason.",0,26,152,2,7.8
biden_sotu_01_045,Biden,SOTU,01,45,"We have the brightest, best trained people in the world. The American Jobs Plan is going to create millions of good-paying jobs—jobs Americans can raise a family on—as my dad would then say, ""with a little breathing room."" And all the investments in the American Jobs Plan will be guided by one principle: buy American. Buy American.",0,57,333,4,17.1
biden_sotu_01_046,Biden,SOTU,01,46,"And I might note, parenthetically, that does not violate any trade agreement. It's been the law since the thirties: buy American. American tax dollars are going to be used to buy American products made in America to create American jobs.",0,40,237,3,12.0
biden_sotu_01_047,Biden,SOTU,01,47,That's the way it's supposed to be and it will be in this administration. And I made it clear to all my Cabinet people. Their ability to give exemptions has been strenuously limited.,0,33,182,3,9.9
biden_sotu_01_048,Biden,SOTU,01,48,It will be American products.,0,5,29,1,1.5
biden_sotu_01_049,Biden,SOTU,01,49,"Now I know some of you at home are wondering whether these jobs are for you. So many of you—so many of the folks I grew up with—feel left behind, forgotten in an economy that's so rapidly changing it's frightening.",0,40,214,2,12.0
biden_sotu_01_050,Biden,SOTU,01,50,"I want to speak directly to you. Because if you think about it, that's what people are most worried about: ""Can I fit in?"" Independent experts estimate the American Jobs Plan will add millions of jobs and trillions of dollars to economic growth in the years to come. It is an 8-year program.",0,53,291,4,15.9
biden_sotu_01_051,Biden,SOTU,01,51,These are good-paying jobs that can't be outsourced. Nearly 90 percent of the infrastructure jobs created in the American Jobs Plan do not require a college degree; 75 percent don't require an associate's degree. The American Jobs Plan is a blue-collar blueprint to build America.,0,45,280,3,13.5
biden_sotu_01_052,Biden,SOTU,01,52,"That's what it is. And it recognizes something I've always said in this Chamber and the other. Good guys and women on Wall Street, but Wall Street didn't build this country.",0,31,173,3,9.3
biden_sotu_01_053,Biden,SOTU,01,53,"The middle class built the country, and unions built the middle class. So that's why I'm calling on Congress to pass the Protect the Right to Organize Act—the PRO Act—and send it to my desk so we can support the right to unionize. And by the way, while you're thinking about sending things to my desk— [laughter]—let's raise the minimum wage to $15.",0,63,349,3,18.9
biden_sotu_01_054,Biden,SOTU,01,54,"No one—no one working 40 hours a week—no one working 40 hours a week should live below the poverty line. We need to ensure greater equity and opportunity for women. And while we're doing this, let's get the Paycheck Fairness Act to my desk as well— equal pay.",0,48,259,3,14.4
biden_sotu_01_055,Biden,SOTU,01,55,"It's been much too long. And if you're wondering whether it's too long, look behind me. And finally, the American Jobs Plan will be the biggest increase in nondefense research and development on record.",0,34,202,3,10.2
biden_sotu_01_056,Biden,SOTU,01,56,We will see more technological change—and some of you know more about this than I do— we'll see more technological change in the next 10 years than we saw in the last 50. That's how rapidly artificial intelligence and so much more is changing. And we're falling behind the competition with the rest of the world.,0,56,312,3,16.8
biden_sotu_01_057,Biden,SOTU,01,57,"Decades ago, we used to invest 2 percent of our gross domestic product in America—2 percent of our gross domestic product—in research and development. Today, Mr. Secretary, that's less than 1 percent.",0,32,200,3,9.6
biden_sotu_01_058,Biden,SOTU,01,58,China and other countries are closing in fast.,0,8,46,1,2.4
biden_sotu_01_059,Biden,SOTU,01,59,"We have to develop and dominate the products and technologies of the future: advanced batteries, biotechnology, computer chips, clean energy. The Secretary of Defense can tell you—and those of you on—who work on national security issues know—the Defense Department has an agency called DARPA—the Defense Advanced Research Project Agency. The people who set up before I came here—and that's been a long time ago—to develop breakthroughs that enhance our national security—that's their only job.",0,74,493,3,22.2
biden_sotu_01_060,Biden,SOTU,01,60,"And it's a semiseparate agency; it's under the Defense Department. It's led to everything from the discovery of the internet to GPS and so much more that's enhanced our security. The National Institute of Health—the NIH—I believe, should create a similar Advanced Research Projects Agency for Health.",0,47,300,3,14.1
biden_sotu_01_061,Biden,SOTU,01,61,"And that would—here's what it would do. It would have a singular purpose: to develop breakthroughs to prevent, detect, and treat diseases like Alzheimer's, diabetes, and cancer. I'll still never forget when we passed the cancer proposal the last year I was Vice President—almost $9 million going to NIH.",0,49,303,3,14.7
biden_sotu_01_062,Biden,SOTU,01,62,"And if you excuse the point of personal privilege, I'll never forget you standing, Mitch, and saying you'd name it after my deceased son. It meant a lot.",0,28,153,2,8.4
biden_sotu_01_063,Biden,SOTU,01,63,"But so many of us have deceased sons, daughters, and relatives who died of cancer. I can think of no more worthy investment. I know of nothing that is more bipartisan.",0,31,167,3,9.3
biden_sotu_01_064,Biden,SOTU,01,64,So let's end cancer as we know it. It's within our power. It's within our power to do it.,0,19,89,3,5.7
biden_sotu_01_065,Biden,SOTU,01,65,"Investments in jobs and infrastructure, like the ones we're talking about, have often had bipartisan support in the past. Vice President Harris and I met regularly in the Oval Office with Democrats and Republicans to discuss the Jobs Plan. And I applaud a group of Republican Senators who just put forward their own proposal.",0,54,325,3,16.2
biden_sotu_01_066,Biden,SOTU,01,66,"So let's get to work. I wanted to lay out, before the Congress, my plan before we got into the deep discussions. I'd like to meet with those who have ideas that are different—they think are better.",0,37,197,3,11.1
biden_sotu_01_067,Biden,SOTU,01,67,"But the rest of the world is not waiting for us. I just want to be clear: From my perspective, doing nothing is not an option. Look, we can't be so busy competing with one another that we forget the competition that we have with the rest of the world to win the 21st century.",0,55,275,3,16.5
biden_sotu_01_068,Biden,SOTU,01,68,"Secretary Blinken can tell you, I spent a lot of time with President Xi: traveled over 17,000 miles with him; spent, they tell me, over 24 hours in private discussions with him.",0,32,177,1,9.6
biden_sotu_01_069,Biden,SOTU,01,69,"When he called to congratulate me, we had a 2-hour discussion. He's deadly earnest about becoming the most significant, consequential nation in the world. He and others—autocrats— think that democracy can't compete in the 21st century with autocracies because it takes too long to get consensus.",0,46,295,3,13.8
biden_sotu_01_070,Biden,SOTU,01,70,"To win that competition for the future, in my view, we also need to make a once-in-a-generation investment in our families and our children. That's why I've introduced the American Families Plan tonight, which addresses four of the biggest challenges facing American families and, in turn, America. First is access to a good education.",0,54,335,3,16.2
biden_sotu_01_071,Biden,SOTU,01,71,"When this Nation made 12 years of public education universal in the last century, it made us the best educated, best prepared Nation in the world. It's, I believe, the overwhelming reason that propelled us to where we got in the 21st—in the 20th century.",0,45,254,2,13.5
biden_sotu_01_072,Biden,SOTU,01,72,"But the world has caught up, or catching up. They are not waiting. I would say, parenthetically: If we were sitting down, put a bipartisan committee together and said, ""Okay, we're going to decide what we do in terms of government providing for free education,"" I wonder whether we'd think, as we did in the 20th century, that 12 years is enough in the 21st century.",0,66,366,3,19.8
biden_sotu_01_073,Biden,SOTU,01,73,"I doubt it. Twelve years is no longer enough today to compete with the rest of the world in the 21st century. That's why my American Families Plan guarantees 4 additional years of public education for every person in America, starting as early as we can.",0,46,254,3,13.8
biden_sotu_01_074,Biden,SOTU,01,74,"The great universities of this country have conducted studies over the last 10 years. It shows that adding 2 years of universal high-quality preschool for every 3-year-old and 4-year-old, no matter what background they come from, it puts them in the position to be able to compete all the way through 12 years. It increases exponentially their prospect of graduating and going on beyond graduation.",0,65,398,3,19.5
biden_sotu_01_075,Biden,SOTU,01,75,The research shows when a young child goes to school—not daycare—they are far more likely to graduate from high school and go to college or something after high school.,0,29,168,1,8.7
biden_sotu_01_076,Biden,SOTU,01,76,"When you add 2 years of free community college on top of that, you begin to change the dynamic. We can do that. And we'll increase Pell Grants and invest in Historical Black Colleges and Universities, Tribal Colleges, Minority-Serving Institutions.",0,40,248,3,12.0
biden_sotu_01_077,Biden,SOTU,01,77,"The reason is: They don't have the endowments, but their students are just as capable of learning about cybersecurity, just as capable of learning about metallurgy— all the things that are going on that provide those jobs of the future. Jill is a community college professor who teaches today as First Lady. She's long said—if I've heard it once, I've heard it a thousand times: ""Joe, any country that outeducates us is going to outcompete us."" She'll be deeply involved in leading this effort.",0,84,494,4,25.2
biden_sotu_01_078,Biden,SOTU,01,78,"Thank you, Jill. Second thing we need: American Families Plan will provide access to quality, affordable childcare. We guarantee—and I'm proposing a legislation to guarantee that low- and middle-income families will pay no more than 7 percent of their income for high-quality care for children up to the age of 5.",0,51,313,3,15.3
biden_sotu_01_079,Biden,SOTU,01,79,"The most hard-pressed working families won't have to spend a dime. Third, the American Families Plan will finally provide up to 12 weeks of paid leave and medical leave—family and medical leave. We're one of the few industrial countries in the world.",0,42,250,3,12.6
biden_sotu_01_080,Biden,SOTU,01,80,"No one should have to choose between a job and paycheck or taking care of themselves and their loved ones—a parent, a spouse, or child. And fourth, the American Family Plan puts directly into the pockets of millions of Americans. In March, we expanded a tax credit for every child in a family.",0,53,293,3,15.9
biden_sotu_01_081,Biden,SOTU,01,81,"Up to $3,000 per child, if they're under 6 years of age—I mean, excuse me—under—over [under]* 6 years of age, and $3,600 for children over 6 years of age. With two parents, two kids, that's $7,200 in the pockets that's going to help to take care of your family. And that will help more than 65 million children and help cut childcare [child]* poverty in half.",0,66,359,3,19.8
