id,president,speech_type,sequence,paragraph_id,content,is_applause,word_count,char_count,sentence_count,reading_time_seconds
biden_sotu_01_165,Biden,SOTU,01,165,"The insurrection was an existential crisis, a test of whether our democracy could survive. And it did.",0,17,102,2,5.1
biden_sotu_01_166,Biden,SOTU,01,166,"But the struggle is far from over. The question of whether our democracy will long endure is both ancient and urgent, as old as our Republic, still vital today. Can our democracy deliver on its promise that all of us, created equal in the image of God, have a chance to lead lives of dignity, respect, and possibility?",0,58,318,3,17.4
biden_sotu_01_167,Biden,SOTU,01,167,"Can our democracy deliver the most—to the most pressing needs of our people? Can our democracy overcome the lies, anger, hate, and fears that have pulled us apart? America's adversaries—the autocrats of the world—are betting we can't.",0,37,234,3,11.1
biden_sotu_01_168,Biden,SOTU,01,168,"And I promise you, they're betting we can't. They believe we're too full of anger and division and rage. They look at the images of the mob that assaulted the Capitol as proof that the sun is setting on American democracy.",0,41,222,3,12.3
biden_sotu_01_169,Biden,SOTU,01,169,But they are wrong. You know it; I know it.,0,10,43,2,3.0
biden_sotu_01_170,Biden,SOTU,01,170,But we have to prove them wrong.,0,7,32,1,2.1
biden_sotu_01_171,Biden,SOTU,01,171,"We have to prove democracy still works, that our Government still works and we can deliver for our people. In our first hundred days together, we've acted to restore the people's faith in democracy to deliver. We're vaccinating the Nation.",0,40,239,3,12.0
biden_sotu_01_172,Biden,SOTU,01,172,"We're creating hundreds of thousands of new jobs. We're delivering real results to people; they can see it and feel it in their own lives. Opening doors of opportunity, guaranteeing some more fairness and justice, that's the essence of America.",0,40,244,3,12.0
biden_sotu_01_173,Biden,SOTU,01,173,"That's democracy in action. Our Constitution opens with the words—as trite as it sounds—""We the People"". Well, it's time to remember that ""We the People"" are the Government—you and I.",0,30,183,3,9.0
biden_sotu_01_174,Biden,SOTU,01,174,Not some force in a distant capital. Not some powerful force that we have no control over. It's us.,0,19,99,3,5.7
biden_sotu_01_175,Biden,SOTU,01,175,"It's ""We the People."" In another era when our democracy was tested, Franklin Roosevelt reminded us, ""In America, we do our part."" We all do our part. That's all I'm asking: that we do our part, all of us. If we do that, we will meet the center challenge of the age by proving that democracy is durable and strong.",0,60,313,5,18.0
biden_sotu_01_176,Biden,SOTU,01,176,Autocrats will not win the future. We will.,0,8,43,2,2.4
biden_sotu_01_177,Biden,SOTU,01,177,"America will. And the future belongs to America. As I stand here tonight before you, in a new and vital hour of life and democracy of our Nation, and I can say with absolute confidence: I have never been more confident or optimistic about America, not because I'm President, because what's happening with the American people.",0,56,325,3,16.8
biden_sotu_01_178,Biden,SOTU,01,178,"We have stared into the abyss of insurrection and autocracy, pandemic and pain, and ""We the People"" did not flinch. At the very moment our adversaries were certain we would pull apart and fail, we came together. We united.",0,39,222,3,11.7
biden_sotu_01_179,Biden,SOTU,01,179,"With light and hope, we summoned a new strength, new resolve to position us to win the competition of the 21st century, on our way to a union more perfect, more prosperous, and more just, as one people, one Nation, and one America. Folks, as I told every world leader I've ever met with over the years, it's never ever, ever been a good bet to bet against America, and it still isn't.",0,73,384,2,21.9
biden_sotu_01_180,Biden,SOTU,01,180,We are the United States of America. There is not a single thing—nothing— nothing beyond our capacity. We can do whatever we set our mind to do if we do it together.,0,32,165,3,9.6
biden_sotu_01_181,Biden,SOTU,01,181,"So let's begin to get together. God bless you all, and may God protect our troops. Thank you for your patience.",0,21,111,3,6.3
biden_sotu_01_182,Biden,SOTU,01,182,NOTE: The President spoke at 9:06 p.m. in the House Chamber of the U.S. Capitol.,0,15,80,5,4.5
biden_sotu_01_183,Biden,SOTU,01,183,"In his remarks, he referred to Senate Minority Leader A. Mitchell McConnell; Brittney Hayes, head charge nurse, Arizona State University's State Farm Stadium vaccination site in Glendale, AZ; President Vladimir Vladimirovich Putin of Russia; Gianna Floyd, daughter of George Floyd, who died during an arrest by police officers in Minneapolis, MN, on May 25, 20; and Derek Chauvin, a former Minneapolis police officer who was convicted in Mr. Floyd's murder on President Biden Addr esses a Joint Session of Congr ess President Biden Addr esses a Joint Session of Congr ess April 20.",0,93,581,3,27.9
biden_sotu_01_184,Biden,SOTU,01,184,"He also referred to H.R. 842, H.R. 7, H.R.",0,9,42,6,2.7
biden_sotu_01_185,Biden,SOTU,01,185,"1280, S.937, H.R. 5, H.R. 1620, and H.R.",0,8,40,7,2.4
biden_sotu_01_186,Biden,SOTU,01,186,1; and the Islamic State of Iraq and Syria (ISIS) terrorist organization. This transcript was released by the Office of the Press Secretary on April 29. * White House correction.,0,30,178,3,9.0
biden_sotu_01_187,Biden,SOTU,01,187,"Joseph R. Biden, Jr., Address Before a Joint Session of the Congress Online",0,13,75,2,3.9
