id,president,speech_type,sequence,paragraph_id,content,is_applause,word_count,char_count,sentence_count,reading_time_seconds
biden_sotu_01_082,Biden,SOTU,01,82,And we can afford it. So we did that in the last piece of legislation we passed.,0,17,80,2,5.1
biden_sotu_01_083,Biden,SOTU,01,83,But let's extend that childcare tax credit at least through the end of 2025. The American Rescue Plan lowered health care premiums for 9 million Americans who buy their coverage under the Affordable Care Act. I know that's really popular on this side of the aisle.,0,46,264,3,13.8
biden_sotu_01_084,Biden,SOTU,01,84,"[Laughter] But let's make that provision permanent so their premiums don't go back up. In addition to my Families Plan, I'm going to work with Congress to address, this year, other critical priorities for American families. The Affordable Care Act has been a lifeline for millions of Americans, protecting people with preexisting conditions, protecting women's health.",0,56,368,3,16.8
biden_sotu_01_085,Biden,SOTU,01,85,And the pandemic has demonstrated how badly—how badly—it's needed. Let's lower deductibles for working families on the Affordable Care—in the Affordable Care Act. And let's lower prescription drug costs.,0,29,203,3,8.7
biden_sotu_01_086,Biden,SOTU,01,86,We know how to do this. The last President had that as an objective. We all know how outrageously expensive drugs are in America.,0,24,129,3,7.2
biden_sotu_01_087,Biden,SOTU,01,87,"In fact, we pay the highest prescription drug prices of anywhere in the world right here in America—nearly three times—for the same drug, nearly three times what other countries pay.",0,30,182,1,9.0
biden_sotu_01_088,Biden,SOTU,01,88,"We have to change that, and we can. Let's do what we've always talked about for all the years I was down here in this body—in Congress. Let's give Medicare the power to save hundreds of billions of dollars by negotiating lower drug prescription prices.",0,45,252,3,13.5
biden_sotu_01_089,Biden,SOTU,01,89,"And by the way, it won't just help people on Medicare, it will lower prescription drug costs for everyone. And the money we save, which is billions of dollars, can go to strengthen the Affordable Care Act and expand Medicare coverage benefits without costing taxpayers an additional penny. It's within our power to do it; let's do it now.",0,59,338,3,17.7
biden_sotu_01_090,Biden,SOTU,01,90,"We've talked about it long enough. Democrats and Republicans, let's get it done this year. This is all about a simple premise: Health care should be a right and not a privilege in America.",0,34,188,3,10.2
biden_sotu_01_091,Biden,SOTU,01,91,"So how do we pay for my Jobs and Family Plan? I made it clear, we can do it without increasing the deficits. Let's start with what I will not do: I will not impose any tax increase on people making less than $400,000.",0,44,217,3,13.2
biden_sotu_01_092,Biden,SOTU,01,92,"It's—but it's time for corporate America and the wealthiest 1 percent of Americans to just begin to pay their fair share. Just their fair share. Sometimes, I have arguments with my friends in the Democratic Party.",0,36,213,3,10.8
biden_sotu_01_093,Biden,SOTU,01,93,"I think you should be able to become a billionaire and a millionaire, but pay your fair share. A recent study shows that 55 of the nation's biggest corporations paid zero Federal tax last year. Those 55 corporations made in excess of $40 billion in profit.",0,46,256,3,13.8
biden_sotu_01_094,Biden,SOTU,01,94,A lot of companies also evade taxes through tax havens in Switzerland and Bermuda and the Cayman Islands. And they benefit from tax loopholes and deductions for offshoring jobs and shifting profits overseas. It's not right.,0,36,223,3,10.8
biden_sotu_01_095,Biden,SOTU,01,95,"We're going to reform corporate taxes so they pay their fair share and help pay for the public investments their businesses will benefit from as well. And we're going to reward work, not just wealth. We take the top tax bracket for the wealthiest 1 percent of Americans—those making over $400,000 or more—back up to where it was when George W.",0,61,343,3,18.3
biden_sotu_01_096,Biden,SOTU,01,96,Bush was President when he started: 39.6 percent. That's where it was when George W. was President.,0,17,99,4,5.1
biden_sotu_01_097,Biden,SOTU,01,97,We're going to get rid of the loopholes that allow Americans who make more than a million dollars a year and pay a lower tax rate on their capital gains than Americans who receive a paycheck. We're only going to affect three-tenths of 1 percent of all Americans by that action—three-tenths of 1 percent. And the IRS is going to crack down on millionaires and billionaires who cheat on their taxes.,0,71,397,3,21.3
biden_sotu_01_098,Biden,SOTU,01,98,"It's estimated to be billions of dollars by think tanks that are left, right, and center. I'm not looking to punish anybody.",0,22,124,2,6.6
biden_sotu_01_099,Biden,SOTU,01,99,"But I will not add a tax burden— additional tax burden to the middle class in this country. They're already paying enough. I believe what I propose is fair, fiscally responsible, and it raises revenue to pay for the plans I have proposed and will create millions of jobs that will grow the economy and enhance our financial standing in the country.",0,62,348,3,18.6
biden_sotu_01_100,Biden,SOTU,01,100,"When you hear someone say that they don't want to raise taxes on the wealthiest 1 percent or corporate America, ask them: ""Whose taxes you want to raise instead? Whose are you going to cut?"" Look, the big tax cut of 2017, remember, it was supposed to pay for itself— that was how it was sold—and generate vast economic growth. Instead, it added $2 trillion to the deficit.",0,68,372,4,20.4
biden_sotu_01_101,Biden,SOTU,01,101,"It was a huge windfall for corporate America and those at the very top. Instead of using the tax saving to raise wages and invest in research and development, it poured billions of dollars into the pockets of CEOs. In fact, the pay gap between CEOs and their workers is now among the largest in history.",0,56,303,3,16.8
biden_sotu_01_102,Biden,SOTU,01,102,"According to one study, CEOs make 320 times what the average worker in their corporation makes. It used to be in the—below a hundred. The pandemic has only made things worse.",0,31,174,3,9.3
biden_sotu_01_103,Biden,SOTU,01,103,"Twenty million Americans lost their job in the pandemic: working and middle class Americans. At the same time, roughly 650 billionaires in America saw their net worth increase by more than $1 trillion, in the same exact period.",0,38,227,2,11.4
biden_sotu_01_104,Biden,SOTU,01,104,"Let me say it again: 650 people increased their wealth by more than $1 trillion during this pandemic. And they're now worth more than $4 trillion. My fellow Americans, trickle-down—trickle-down—economics has never worked, and it's time to grow the economy from the bottom and the middle out.",0,47,291,3,14.1
biden_sotu_01_105,Biden,SOTU,01,105,"You know, there's a broad consensus of economists—left, right, center —and they agree what I'm proposing will help create millions of jobs and generate historic economic growth. These are among the highest value investments we can make as a Nation. I've often said: Our greatest strength is the power of our example, not just the example of our power.",0,59,351,3,17.7
biden_sotu_01_106,Biden,SOTU,01,106,"In my conversations with world leaders—and I've spoken to over 38, 40 of them now—I've made it known—I've made it known—that America is back. And you know what they say? The comment that I hear most of all from them is they say: ""We see America is back, but for how long?",0,52,271,3,15.6
biden_sotu_01_107,Biden,SOTU,01,107,"But for how long?"" My fellow Americans, we have to show not just that we're back, but that we're back to stay and that we aren't going to go it alone. We're going to do it by leading with our allies. No one nation can deal with all the crises of our time—from terrorism, to nuclear proliferation, mass migration, cybersecurity, climate change, as well as experiencing—what we're experiencing now with pandemics.",0,71,411,4,21.3
biden_sotu_01_108,Biden,SOTU,01,108,"There's no wall high enough to keep any virus out. And our own vaccine supply, as it grows to meet our needs—and we're meeting them—will become an arsenal for vaccines for other countries, just as America was the arsenal of democracy for the world and, in consequence, influenced the world.",0,50,290,2,15.0
biden_sotu_01_109,Biden,SOTU,01,109,"But every American will have access before that occurs—every American will have access to be fully covered by COVID-19 from the vaccines we have. Look, the climate crisis is not our fight alone, it's a global fight.",0,37,215,2,11.1
biden_sotu_01_110,Biden,SOTU,01,110,"The United States accounts, as all of you know, less than 15 percent of carbon emissions. The rest of the world accounts for 85 percent. That's why I kept my commitment to rejoin the Paris accord—because if we do everything perfectly, it's not going to ultimately matter.",0,47,271,3,14.1
biden_sotu_01_111,Biden,SOTU,01,111,"I kept my commitment to convene a climate summit right here in America with all of the major economies of the world—China, Russia, India, the European Union—and I said I'd do it in my first hundred days.",0,37,203,1,11.1
biden_sotu_01_112,Biden,SOTU,01,112,"I want to be very blunt about it: I had—my attempt was to make sure that the world could see there was a consensus, that we are at an inflection point in history. And consensus—the consensus is: If we act to save the planet, we can create millions of jobs and economic growth and opportunity to raise the standard of living to almost everyone around the world. If you've watched any of it—and you were all busy; I'm sure you didn't have much time—that's what virtually every nation said, even the ones that aren't doing their fair share.",0,98,537,3,29.4
biden_sotu_01_113,Biden,SOTU,01,113,"The investments I've proposed tonight also advance the foreign policy, in my view, that benefits the middle class. That means making sure every nation plays by the same rules in the global economy, including China. My discussions—in my discussions with President Xi, I told him, ""We welcome the competition.",0,49,307,3,14.7
biden_sotu_01_114,Biden,SOTU,01,114,"We're not looking for conflict."" But I made absolutely clear that we will defend America's interests across the board.",0,19,118,2,5.7
biden_sotu_01_115,Biden,SOTU,01,115,"America will stand up to unfair trade practices that undercut American workers and American industries, like subsidies from state—to state-owned operations and enterprises and the theft of American technology and intellectual property. I also told President Xi that we'll maintain a strong military presence in the Indo-Pacific, just as we do with NATO in Europe, not to start a conflict, but to prevent one. I told him what I've said to many world leaders: that America will not back away from our commitments—our commitment to human rights and fundamental freedoms and to our alliances.",0,94,588,3,28.2
biden_sotu_01_116,Biden,SOTU,01,116,And I pointed out to him: No responsible American President could remain silent when basic human rights are being so blatantly violated. An American President has to represent the essence of what our country stands for.,0,36,219,2,10.8
biden_sotu_01_117,Biden,SOTU,01,117,"America is an idea, the most unique idea in history: We are created, all of us, equal. It's who we are, and we cannot walk away from that principle and, in fact, say we're dealing with the American idea. With regard to Russia, I know it concerns some of you, but I made very clear to Putin that we're not going to seek—excuse me—escalation, but their actions will have consequence if they turn out to be true.",0,77,409,3,23.1
biden_sotu_01_118,Biden,SOTU,01,118,"And they turned out to be true, so I responded directly and proportionally to Russia's interference in our elections and the cyber attacks on our Government and our business. They did both of these things, and I told them we would respond, and we have.",0,45,252,2,13.5
biden_sotu_01_119,Biden,SOTU,01,119,"But we can also cooperate when it's in our mutual interest. We did it when we extended the New START Treaty on nuclear arms, and we're working to do it on climate change.",0,33,170,2,9.9
biden_sotu_01_120,Biden,SOTU,01,120,"But he understands we will respond. On Iran and North Korea—nuclear programs that present serious threats to American security and the security of the world—we're going to be working closely with our allies to address the threats posed by both of these countries through diplomacy, as well as stern deterrence. And American leadership means ending the forever war in Afghanistan.",0,60,379,3,18.0
biden_sotu_01_121,Biden,SOTU,01,121,"We have, without hyperbole, the greatest fighting force in the history of the world. I'm the first President in 40 years who knows what it means to have a son serving in a war zone. Today, we have servicemembers serving in the same war zone as their parents did.",0,49,262,3,14.7
biden_sotu_01_122,Biden,SOTU,01,122,"We have servicemembers in Afghanistan who were not yet born on 9/11. The war in Afghanistan, as we remember the debates here, were never meant to be multigenerational undertakings of nation-building. We went to Afghanistan to get terrorists—the terrorists who attacked us on 9/11—and we said we would follow Usama bin Laden to the gates of hell to do it.",0,60,354,3,18.0
biden_sotu_01_123,Biden,SOTU,01,123,"If you've been to the upper Kunar Valley, you've kind of seen the gates of hell. And we delivered justice to bin Laden. We degraded the terrorist threat of Al Qaida in Afghanistan.",0,33,180,3,9.9
biden_sotu_01_124,Biden,SOTU,01,124,"And after 20 years of value—valor and sacrifice, it's time to bring those troops home. Look, even as we do, we will maintain an over-the-horizon capacity to suppress future threats to the homeland. And make no mistake: In 20 years, terrorists has—terrorism has metastasized.",0,44,274,3,13.2
biden_sotu_01_125,Biden,SOTU,01,125,"The threat has evolved way beyond Afghanistan. And those of you in the intelligence committees, the foreign relations committee, the defense committees, you know well: We have to remain vigilant against the threats to the United States wherever they come from. Al Qaida and ISIS are in Yemen, Syria, Somalia, other places in Africa, the Middle East, and beyond.",0,59,361,3,17.7
biden_sotu_01_126,Biden,SOTU,01,126,"And we won't ignore what our intelligence agencies have determined to be the most lethal terrorist threat to the homeland today: White supremacy is terrorism. We're not going to ignore that either. My fellow Americans, look, we have to come together to heal the soul of this Nation.",0,48,282,3,14.4
biden_sotu_01_127,Biden,SOTU,01,127,"It was nearly a year ago, before her father's funeral, when I spoke with Gianna Floyd, George Floyd's young daughter. She's a little tyke, so I was kneeling down to talk to her so I could look her in the eye. And she looked at me and she said, ""My daddy changed the world."" Well, after the conviction of George Floyd's murderer, we can see how right she was if we have the courage to act as a Congress.",0,79,402,4,23.7
biden_sotu_01_128,Biden,SOTU,01,128,We've all seen the knee of injustice on the neck of Black Americans.,0,13,68,1,3.9
biden_sotu_01_129,Biden,SOTU,01,129,"Now is our opportunity to make some real progress. The vast majority of men and women wearing the uniform and a badge serve our communities, and they serve them honorably. I know them.",0,33,184,3,9.9
biden_sotu_01_130,Biden,SOTU,01,130,"I know they want to help meet this moment as well. My fellow Americans, we have to come together to rebuild trust between law enforcement and the people they serve, to root out systemic racism in our criminal justice system, and to enact police reform in George Floyd's name that passed the House already. I know Republicans have their own ideas and are engaged in the very productive discussions with Democrats in the Senate.",0,74,426,3,22.2
biden_sotu_01_131,Biden,SOTU,01,131,We need to work together to find a consensus.,0,9,45,1,2.7
biden_sotu_01_132,Biden,SOTU,01,132,"But let's get it done next month, by the first anniversary of George Floyd's death. The country supports this reform, and Congress should act—should act.",0,25,153,2,7.5
biden_sotu_01_133,Biden,SOTU,01,133,"We have a giant opportunity to bend to the arc of the moral universe towards justice—real justice. And with the plans outlined tonight, we have a real chance to root out systemic racism that plagues America and American lives in other ways; a chance to deliver real equity—good jobs, good schools, affordable housing, clean air, clean water, being able to generate wealth and pass it down two generations because you have an access to purchase a house. Real opportunities in the lives of more Americans: Black, White, Latino, Asian Americans, Native Americans.",0,92,560,3,27.6
biden_sotu_01_134,Biden,SOTU,01,134,"Look, I also want to thank the United States Senate for voting 94 to 1 to pass the COVID-19 Hate Crimes Act to protect Asian Americans and Pacific Islanders. You acted decisively. And you can see on television the viciousness of the hate crimes we've seen over the past year—this past year and for too long.",0,56,307,3,16.8
biden_sotu_01_135,Biden,SOTU,01,135,"I urge the House to do the same and send that legislation to my desk, which I will gladly, anxiously sign. I also hope Congress can get to my desk the Equality Act to protect LGBTQ Americans.",0,37,191,2,11.1
biden_sotu_01_136,Biden,SOTU,01,136,"To all transgender Americans watching at home, especially young people who are so brave, I want you to know your President has your back. Another thing: Let's authorize the Violence Against Women Act, which has been law for 27 years. Twenty-seven years ago, I wrote it.",0,46,269,3,13.8
biden_sotu_01_137,Biden,SOTU,01,137,"It will close the— the act that has to be authorized now will close the ""boyfriend"" loophole to keep guns out of the hands of abusers. The court order said: ""This is an abuser. You can't own a gun."" It's to close that loophole that existed.",0,46,240,4,13.8
biden_sotu_01_138,Biden,SOTU,01,138,"You know, it's estimated that 50 women are shot and killed by an intimate partner every month in America—50 a month. Let's pass it and save some lives. And I need not tell anyone this, but gun violence is becoming an epidemic in America.",0,44,237,3,13.2
biden_sotu_01_139,Biden,SOTU,01,139,"The flag at the White House was still flying at half-mast for the 8 victims in the mass shooting in Georgia when 10 more lives were taken in a mass shooting in Colorado. And, in the week in between those two events, 250 other Americans were shot dead in the streets of America—250 shot dead. I know how hard it is to make progress on this issue.",0,67,345,3,20.1
biden_sotu_01_140,Biden,SOTU,01,140,"In the nineties, we passed universal background checks, a ban on assault weapons and high- capacity magazines that hold 100 rounds that can be fired off in seconds. We beat the NRA. Mass shootings and gun violence declined.",0,38,223,3,11.4
biden_sotu_01_141,Biden,SOTU,01,141,Check out the report over 10 years.,0,7,35,1,2.1
biden_sotu_01_142,Biden,SOTU,01,142,"But in the early twenty—2000s, the law expired, and we've seen daily bloodshed since. I'm not saying if the law continued, we wouldn't see bloodshed. More than 2 weeks ago in the Rose Garden, surrounded by some of the bravest people I know—the survivors and families who lost loved ones to gun violence—I laid out several of the Department of Justice actions that are being taken to impact on this epidemic.",0,71,407,3,21.3
biden_sotu_01_143,Biden,SOTU,01,143,"One of them is banning so-called ""ghost guns."" These are homemade guns built from a kit that includes directions on how to finish the firearm. The parts have no serial numbers, so they show up at crime scenes, and they can't be traced. The buyers of these ghost gun kits aren't required to pass any background check.",0,57,316,4,17.1
biden_sotu_01_144,Biden,SOTU,01,144,"Anyone, from a criminal or terrorist, could buy this kit and, within 30 minutes, have a weapon that's lethal.",0,19,109,1,5.7
biden_sotu_01_145,Biden,SOTU,01,145,"But no more. And I will do everything in my power to protect the American people from this epidemic of gun violence, but it's time for Congress to act as well. Look, I don't want to become confrontational, but we need more Senate Republicans to join the overwhelming majority of Democratic colleagues and close the loopholes requiring a background check on purchases of guns.",0,64,375,3,19.2
biden_sotu_01_146,Biden,SOTU,01,146,"We need a ban on assault weapons and high-capacity magazines. And don't tell me it can't be done. We did it before, and it worked.",0,25,130,3,7.5
biden_sotu_01_147,Biden,SOTU,01,147,Talk to most responsible gun owners and hunters. They'll tell you there's no possible justification for having 100 rounds in a weapon. What do you think: deer are wearing Kevlar vests?,0,31,184,3,9.3
biden_sotu_01_148,Biden,SOTU,01,148,"[Laughter] No, what's—they'll tell you that there are too many people today who are able to buy a gun, but shouldn't be able to buy a gun. These kinds of reasonable reforms have overwhelming support from the American people, including many gun owners. The country supports reform and is—and Congress should act.",0,52,311,3,15.6
biden_sotu_01_149,Biden,SOTU,01,149,"This shouldn't be a red or blue issue. And no amendment to the Constitution is absolute. You can't yell ""Fire!"" in a crowded theater.",0,24,133,4,7.2
biden_sotu_01_150,Biden,SOTU,01,150,"From the very beginning, there were certain guns, weapons, that could not be owned by Americans. Certain people could not own those weapons ever. We're not changing the Constitution; we're being reasonable.",0,32,206,3,9.6
biden_sotu_01_151,Biden,SOTU,01,151,"I think this is not a Democrat or Republican issue, I think it's an American issue. And here's what else we can do: Immigration has always been essential to America. Let's end our exhausting war over immigration.",0,37,212,3,11.1
biden_sotu_01_152,Biden,SOTU,01,152,"For more than 30 years, politicians have talked about immigration reform, and we've done nothing about it. It's time to fix it. On day one of my Presidency, I kept my commitment and sent a comprehensive immigration bill to the United States Congress.",0,43,250,3,12.9
biden_sotu_01_153,Biden,SOTU,01,153,"If you believe we need to secure the border, pass it, because it has a lot of money for high-tech border security. If you believe in a pathway to citizenship, pass it so over 11 million undocumented folks—the vast majority are here overstaying visas. Pass it.",0,46,259,3,13.8
biden_sotu_01_154,Biden,SOTU,01,154,"We can actually—if you actually want to solve a problem, I've sent a bill to—so take a close look at it.",0,21,104,1,6.3
biden_sotu_01_155,Biden,SOTU,01,155,"We have to—also have to get at the root problem of why people are fleeing, particularly to—to our southern border from Guatemala, Honduras, and El Salvador: the violence, the corruption, the gangs, and the political instability, hunger, hurricanes, earthquakes, natural disasters.",0,41,280,1,12.3
biden_sotu_01_156,Biden,SOTU,01,156,"When I was President, my President—when I was Vice President, the President asked me to focus on providing the help needed to address the root causes of migration. And it helped keep people in their own countries instead of being forced to leave. The plan was working, but the last administration decided it was not worth it.",0,57,325,3,17.1
biden_sotu_01_157,Biden,SOTU,01,157,I'm restoring the program and asked Vice President Harris to lead our diplomatic effort to take care of this.,0,19,109,1,5.7
biden_sotu_01_158,Biden,SOTU,01,158,"I have absolute confidence she'll get the job done. Now, look, if you don't like my plan, let's at least pass what we all agree on. Congress needs to pass legislation this year to finally secure protection for ""dreamers,"" the young people who have only known America as their home.",0,50,281,3,15.0
biden_sotu_01_159,Biden,SOTU,01,159,"And permanent protection for immigrants who are here on temporary protected status who came from countries beset by manmade and natural- made—violence and disaster. As well as a pathway to citizenship for farmworkers who put food on our tables. Look, immigrants have done so much for America during this pandemic and throughout our history.",0,54,340,3,16.2
biden_sotu_01_160,Biden,SOTU,01,160,"The country supports immigration reform. We should act. Let's argue over it, let's debate it, but let's act.",0,18,108,3,5.4
biden_sotu_01_161,Biden,SOTU,01,161,"And if we truly want to restore the soul of America, we need to protect the sacred right to vote. Most people—more people voted in the last Presidential election than any time in American history, in the middle of the worst pandemic ever. It should be celebrated.",0,47,263,3,14.1
biden_sotu_01_162,Biden,SOTU,01,162,"Instead, it's being attacked. Congress should pass H.R. 1 and the John Lewis Voting Rights Act and send it to my desk right away.",0,24,129,4,7.2
biden_sotu_01_163,Biden,SOTU,01,163,"The country supports it. The Congress should act now. Look, in closing, as we gather here tonight, the images of a violent mob assaulting this Capitol, desecrating our democracy, remain vivid in all our minds.",0,35,209,3,10.5
biden_sotu_01_164,Biden,SOTU,01,164,Lives were put at risk—many of your lives. Lives were lost. Extraordinary courage was summoned.,0,15,95,3,4.5
